19:33:35.853139 IP f5467aaa-997b-426f-b545-bbff1a050881.internal.cloudapp.net.49764 > 20.204.39.31.19171: UDP, length 1
E...<.@.@...
.....'..dJ..	G..
19:33:35.853147 IP f5467aaa-997b-426f-b545-bbff1a050881.internal.cloudapp.net.49764 > 20.204.39.31.19171: UDP, length 0
E...<.@.@...
.....'..dJ...G.
19:33:35.853151 IP f5467aaa-997b-426f-b545-bbff1a050881.internal.cloudapp.net.49764 > 20.204.39.31.19171: UDP, length 36
E..@<.@.@...
.....'..dJ..,G=AAAAAAAAAAAAAAAAAAAAAAAAAAAAAAAAAAAA
19:33:35.853155 IP f5467aaa-997b-426f-b545-bbff1a050881.internal.cloudapp.net.49764 > 20.204.39.31.19171: UDP, length 35
E..?<.@.@...
.....'..dJ..+G<BBBBBBBBBBBBBBBBBBBBBBBBBBBBBBBBBBB
19:33:35.853159 IP f5467aaa-997b-426f-b545-bbff1a050881.internal.cloudapp.net.49764 > 20.204.39.31.19171: UDP, length 1
E...<.@.@...
.....'..dJ..	G..
19:33:35.853164 IP f5467aaa-997b-426f-b545-bbff1a050881.internal.cloudapp.net.44535 > 20.204.39.31.19171: UDP, length 1
E...<.@.@...
.....'...J..	G..
19:33:35.853165 IP f5467aaa-997b-426f-b545-bbff1a050881.internal.cloudapp.net.49764 > 20.204.39.31.19171: UDP, length 5
E..!<.@.@...
.....'..dJ...G.r....
19:33:35.853171 IP f5467aaa-997b-426f-b545-bbff1a050881.internal.cloudapp.net.49764 > 20.204.39.31.19171: UDP, length 13
E..)<.@.@...
.....'..dJ...G&0:...0...Ji..
19:33:35.853173 IP f5467aaa-997b-426f-b545-bbff1a050881.internal.cloudapp.net.44535 > 20.204.39.31.19171: UDP, length 0
E...<.@.@...
.....'...J...G.
19:33:35.853177 IP f5467aaa-997b-426f-b545-bbff1a050881.internal.cloudapp.net.49764 > 20.204.39.31.19171: UDP, length 14
E..*<.@.@...
.....'..dJ...G'www.google.com
19:33:35.853180 IP f5467aaa-997b-426f-b545-bbff1a050881.internal.cloudapp.net.44535 > 20.204.39.31.19171: UDP, length 36
E..@<.@.@...
.....'...J..,G=AAAAAAAAAAAAAAAAAAAAAAAAAAAAAAAAAAAA
19:33:35.853183 IP f5467aaa-997b-426f-b545-bbff1a050881.internal.cloudapp.net.49764 > 20.204.39.31.19171: UDP, length 0
E...<.@.@...
.....'..dJ...G.
19:33:35.853186 IP f5467aaa-997b-426f-b545-bbff1a050881.internal.cloudapp.net.44535 > 20.204.39.31.19171: UDP, length 35
E..?<.@.@...
.....'...J..+G<BBBBBBBBBBBBBBBBBBBBBBBBBBBBBBBBBBB
19:33:35.853188 IP f5467aaa-997b-426f-b545-bbff1a050881.internal.cloudapp.net.44407 > 20.204.39.31.19171: UDP, length 1
E...<.@.@...
.....'..wJ..	G..
19:33:35.853189 IP f5467aaa-997b-426f-b545-bbff1a050881.internal.cloudapp.net.49764 > 20.204.39.31.19171: UDP, length 40
E..D<.@.@...
.....'..dJ..0GA........................................
19:33:35.853192 IP f5467aaa-997b-426f-b545-bbff1a050881.internal.cloudapp.net.44535 > 20.204.39.31.19171: UDP, length 1
E...<.@.@...
.....'...J..	G..
19:33:35.853194 IP f5467aaa-997b-426f-b545-bbff1a050881.internal.cloudapp.net.49764 > 20.204.39.31.19171: UDP, length 48
E..L<.@.@...
